Title,Year,Rated,Released,Runtime,Genre,Director,Writer,Actors,Plot,Language,Country,Poster,Metascore,imdbID,imdbRating,imdbVotes,Type,Production
Holidate,2020,TV-MA,28 Oct 2020,103 min,"Comedy, Romance",John Whitesell,Tiffany Paulsen,"Emma Roberts, Luke Bracey, Kristin Chenoweth, Frances Fisher","Fed up with being single on holidays, two strangers agree to be each other's platonic plus-ones all year long, only to catch real feelings along the way.",English,USA,https://m.media-amazon.com/images/M/MV5BYWVmYTFjODItOTY2Ni00NDhhLTk1ZDYtMzBmOGFhZTMyY2Q0XkEyXkFqcGdeQXVyMTEyMjM2NDc2._V1_SX300.jpg,44,tt9866072,6.1,"12,141",movie,N/A
Borat Subsequent Moviefilm,2020,R,23 Oct 2020,95 min,"Adventure, Comedy",Jason Woliner,"Sacha Baron Cohen (screenplay by), Anthony Hines (screenplay by), Dan Swimer (screenplay by), Peter Baynham (screenplay by), Erica Rivinoja (screenplay by), Dan Mazer (screenplay by), Jena Friedman (screenplay by), Lee Kern (screenplay by), Sacha Baron Cohen (story by), Anthony Hines (story by), Dan Swimer (story by), Nina Pedrad (story by), Sacha Baron Cohen (based on character created by)","Sacha Baron Cohen, Maria Bakalova, Tom Hanks, Dani Popescu",Follow-up film to the 2006 comedy centering on the real-life adventures of a fictional Kazakh television journalist named Borat.,"English, Bulgarian, Hebrew, Romanian","UK, USA",https://m.media-amazon.com/images/M/MV5BZmY2ZmM5YTktZThiOC00YjEzLTg4YTctMDAxYWEyZmEyZDlhXkEyXkFqcGdeQXVyMjkwOTAyMDU@._V1_SX300.jpg,68,tt13143964,6.8,"75,370",movie,N/A
Hocus Pocus,1993,PG,16 Jul 1993,96 min,"Comedy, Family, Fantasy",Kenny Ortega,"David Kirschner (story), Mick Garris (story), Mick Garris (screenplay), Neil Cuthbert (screenplay)","Bette Midler, Sarah Jessica Parker, Kathy Najimy, Omri Katz","A curious youngster moves to Salem, where he struggles to fit in before awakening a trio of diabolical witches that were executed in the 17th century.","English, French",USA,https://m.media-amazon.com/images/M/MV5BMWUxNWI0YTYtY2RiZS00ZjNmLTg4ZGUtNDI0Mzk4NmQ5NWE5XkEyXkFqcGdeQXVyNjk1Njg5NTA@._V1_SX300.jpg,N/A,tt0107120,6.9,"101,320",movie,Walt Disney Pictures
The Witches,1990,PG,24 Aug 1990,91 min,"Adventure, Comedy, Family, Fantasy, Horror, Mystery",Nicolas Roeg,"Roald Dahl (book), Allan Scott (screenplay)","Anjelica Huston, Mai Zetterling, Jasen Fisher, Rowan Atkinson","A young boy stumbles onto a witch convention and must stop them, even after he has been turned into a mouse.",English,"UK, USA",https://m.media-amazon.com/images/M/MV5BMjI1MDg5NzAyMV5BMl5BanBnXkFtZTgwNzU5Mzk4NjE@._V1_SX300.jpg,78,tt0100944,6.8,"38,250",movie,"Jim Henson Productions, Lorimar Film Entertainment"
His House,2020,TV-14,30 Oct 2020,93 min,"Drama, Horror, Thriller",Remi Weekes,"Felicity Evans (Story by), Toby Venables (Story by), Remi Weekes","Sope Dirisu, Wunmi Mosaku, Malaika Wakoli-Abigaba, Javier Botet","A refugee couple makes a harrowing escape from war-torn South Sudan, but then they struggle to adjust to their new life in an English town that has an evil lurking beneath the surface.",English,UK,https://m.media-amazon.com/images/M/MV5BODY2NjQzYzYtYTgyMy00M2MxLTgyMWQtZTU1NWZjZWU4ZDc3XkEyXkFqcGdeQXVyNjEwNTM2Mzc@._V1_SX300.jpg,72,tt8508734,6.3,"2,623",movie,N/A
Rebecca,1940,Approved,12 Apr 1940,130 min,"Drama, Mystery, Romance, Thriller",Alfred Hitchcock,"Daphne Du Maurier (celebrated novel), Robert E. Sherwood (screen play), Joan Harrison (screen play), Philip MacDonald (adaptation), Michael Hogan (adaptation)","Laurence Olivier, Joan Fontaine, George Sanders, Judith Anderson",A self-conscious woman juggles adjusting to her new role as an aristocrat's wife and avoiding being intimidated by his first wife's spectral presence.,"English, French",USA,https://m.media-amazon.com/images/M/MV5BYTcxYWExOTMtMWFmYy00ZjgzLWI0YjktNWEzYzJkZTg0NDdmL2ltYWdlXkEyXkFqcGdeQXVyNjc1NTYyMjg@._V1_SX300.jpg,86,tt0032976,8.1,"120,269",movie,Selznick International Pictures
The Trial of the Chicago 7,2020,R,16 Oct 2020,129 min,"Drama, History, Thriller",Aaron Sorkin,Aaron Sorkin,"Eddie Redmayne, Alex Sharp, Sacha Baron Cohen, Jeremy Strong","The story of 7 people on trial stemming from various charges surrounding the uprising at the 1968 Democratic National Convention in Chicago, Illinois.",English,"USA, UK, India",https://m.media-amazon.com/images/M/MV5BYjYzOGE1MjUtODgyMy00ZDAxLTljYTgtNzk0Njg2YWQwMTZhXkEyXkFqcGdeQXVyMDM2NDM2MQ@@._V1_SX300.jpg,76,tt1070874,7.9,"50,886",movie,N/A
Knock Knock,2015,R,09 Oct 2015,99 min,"Drama, Thriller",Eli Roth,"Eli Roth (screenplay), Nicolás López (screenplay), Guillermo Amoedo (screenplay), Anthony Overman (story), Michael Ronald Ross (story)","Keanu Reeves, Lorenza Izzo, Ana de Armas, Aaron Burns","A devoted father helps two stranded young women who knock on his door, but his kind gesture turns into a dangerous seduction and a deadly game of cat and mouse.","English, Spanish","USA, Chile, Israel",https://m.media-amazon.com/images/M/MV5BYTQ3MzhlZjQtNWMxOS00NTEzLTgzOWYtNTI3MjhmZGU0ZDM2XkEyXkFqcGdeQXVyMTQxNzMzNDI@._V1_SX300.jpg,53,tt3605418,4.9,"77,781",movie,"Dragonfly, Camp Grey, Sobras International Pictures"
Hubie Halloween,2020,PG-13,07 Oct 2020,102 min,"Comedy, Fantasy, Mystery",Steven Brill,"Tim Herlihy, Adam Sandler","Adam Sandler, Kevin James, Julie Bowen, Ray Liotta","Despite his devotion to his hometown of Salem (and its Halloween celebration), Hubie Dubois is a figure of mockery for kids and adults alike. But this year, something is going bump in the night, and it's up to Hubie to save Halloween.",English,USA,https://m.media-amazon.com/images/M/MV5BMTE0N2EyMzgtMWJhZS00ZWNmLThjZmQtMjcxYTk1NTJiMGVkXkEyXkFqcGdeQXVyNjY1MTg4Mzc@._V1_SX300.jpg,53,tt10682266,5.2,"15,817",movie,N/A
Halloween,1978,R,27 Oct 1978,91 min,"Horror, Thriller",John Carpenter,"John Carpenter (screenplay by), Debra Hill (screenplay by)","Donald Pleasence, Jamie Lee Curtis, Nancy Kyes, P.J. Soles","Fifteen years after murdering his sister on Halloween night 1963, Michael Myers escapes from a mental hospital and returns to the small town of Haddonfield, Illinois to kill again.",English,USA,https://m.media-amazon.com/images/M/MV5BNzk1OGU2NmMtNTdhZC00NjdlLWE5YTMtZTQ0MGExZTQzOGQyXkEyXkFqcGdeQXVyMTQxNzMzNDI@._V1_SX300.jpg,87,tt0077651,7.8,"229,636",movie,Falcon Films
After We Collided,2020,R,23 Oct 2020,105 min,"Drama, Romance",Roger Kumble,"Anna Todd (screenplay by), Mario Celaya (screenplay by), Anna Todd (based on the novel by)","Josephine Langford, Hero Fiennes Tiffin, Dylan Sprouse, Louise Lombard","Based on the 2014 romance novel of the same name, this follows the love life of two young adults.","English, Chinese",USA,https://m.media-amazon.com/images/M/MV5BN2UyNGM3MDUtMTIzZi00ZDdkLThlYTktYjk0ZDMzM2JiMjMyXkEyXkFqcGdeQXVyNzE0MjkxMzA@._V1_SX300.jpg,14,tt10362466,5.1,"8,841",movie,N/A
Rogue City,2020,N/A,30 Oct 2020,116 min,"Action, Crime, Drama, Thriller",Olivier Marchal,Olivier Marchal,"Lannick Gautry, Stanislas Merhar, Kaaris, David Belle","Caught in the cross hairs of police corruption and Marseille's warring gangs, a loyal cop must protect his squad by taking matters into his own hands.",French,France,https://m.media-amazon.com/images/M/MV5BMjdmMjI0YzktOTliMS00Yzc1LThhMDEtZGE3NmZjNzdhYWIyXkEyXkFqcGdeQXVyNjEwNTM2Mzc@._V1_SX300.jpg,N/A,tt10127684,6.1,717,movie,N/A
Tenet,2020,PG-13,03 Sep 2020,150 min,"Action, Sci-Fi",Christopher Nolan,Christopher Nolan,"Juhan Ulfsak, Jefferson Hall, Ivo Uukkivi, Andrew Howard","Armed with only one word, Tenet, and fighting for the survival of the entire world, a Protagonist journeys through a twilight world of international espionage on a mission that will unfold in something beyond real time.","English, Russian, Ukrainian, Estonian","UK, USA",https://m.media-amazon.com/images/M/MV5BYzg0NGM2NjAtNmIxOC00MDJmLTg5ZmYtYzM0MTE4NWE2NzlhXkEyXkFqcGdeQXVyMTA4NjE0NjEy._V1_SX300.jpg,69,tt6723592,7.8,"142,673",movie,"Syncopy, Warner Bros. Pictures"
Halloween Kills,2021,N/A,15 Oct 2021,N/A,"Horror, Thriller",David Gordon Green,"John Carpenter (based on characters created by), David Gordon Green, Debra Hill (based on characters created by), Danny McBride, Scott Teems","Judy Greer, Anthony Michael Hall, Jamie Lee Curtis, Kyle Richards",The saga of Michael Myers and Laurie Strode continues in the next thrilling chapter of the Halloween series.,English,"UK, USA",https://m.media-amazon.com/images/M/MV5BNzZhY2Q4OTAtZDdlMi00OTljLWFlNjItMmViY2ZmZWRkZjdiXkEyXkFqcGdeQXVyNjIzNzM4NzA@._V1_SX300.jpg,N/A,tt10665338,N/A,N/A,movie,N/A
,,,,,,,,,,,,,,,,,,
Love and Monsters,2020,PG-13,16 Oct 2020,109 min,"Action, Adventure, Comedy",Michael Matthews,"Brian Duffield (screenplay by), Matthew Robinson (screenplay by), Brian Duffield (story by)","Dylan O'Brien, Jessica Henwick, Michael Rooker, Dan Ewing","In a monster-infested world, Joel learns his girlfriend is just 80 miles away. To make the dangerous journey, Joel discovers his inner hero to be with the girl of his dreams.",English,"Canada, USA",https://m.media-amazon.com/images/M/MV5BYWVkMWEyMDUtZTVmOC00MTYxLWE1ZTUtNjk4M2IzMjY2OTIxXkEyXkFqcGdeQXVyMDk5Mzc5MQ@@._V1_SX300.jpg,59,tt2222042,7.0,"16,809",movie,N/A
The Witches,1990,PG,24 Aug 1990,91 min,"Adventure, Comedy, Family, Fantasy, Horror, Mystery",Nicolas Roeg,"Roald Dahl (book), Allan Scott (screenplay)","Anjelica Huston, Mai Zetterling, Jasen Fisher, Rowan Atkinson","A young boy stumbles onto a witch convention and must stop them, even after he has been turned into a mouse.",English,"UK, USA",https://m.media-amazon.com/images/M/MV5BMjI1MDg5NzAyMV5BMl5BanBnXkFtZTgwNzU5Mzk4NjE@._V1_SX300.jpg,78,tt0100944,6.8,"38,250",movie,"Jim Henson Productions, Lorimar Film Entertainment"
The Craft: Legacy,2020,PG-13,28 Oct 2020,97 min,"Drama, Fantasy, Horror",Zoe Lister-Jones,"Zoe Lister-Jones, Peter Filardi (based on characters created by)","Cailee Spaeny, Zoey Luna, Gideon Adlon, Lovie Simone","A group of high school students form a coven of witches. A sequel to the 1996 film, ""The Craft"".",English,"USA, Canada",https://m.media-amazon.com/images/M/MV5BNjY0YzYwM2YtMzcyOC00YmFjLTgxMzEtNzg0YjEwYjlhY2I5XkEyXkFqcGdeQXVyMTEyMjM2NDc2._V1_SX300.jpg,54,tt4685762,4.2,"3,441",movie,N/A
Let Him Go,2017,N/A,01 Jul 2017,9 min,"Short, Drama",Francis X. Lord,"Nigel Goodwin (story by), Francis X. Lord","Kym Veldman, Kathryn Rigby, Nigel Goodwin, Noel Ross","A girl wakes beside her father who is being left kept alive on life support. Her mother is there with a doctor but also, more alarmingly, a priest.",English,UK,https://m.media-amazon.com/images/M/MV5BYzE2NjkyMDEtYmViYS00ZjExLTg2NzUtYzkxNWIwMjEwMmUzXkEyXkFqcGdeQXVyOTA3ODU2Nw@@._V1_SX300.jpg,N/A,tt7088542,7.8,16,movie,N/A
Operation Christmas Drop,2020,TV-G,05 Nov 2020,95 min,"Comedy, Family, Romance",Martin Wood,"Gregg Rossen, Brian Sawyer","Kat Graham, Alexander Ludwig, Trezzo Mahoro, Bethany Brown","Congressional aide Erica (Graham) forgoes family Christmas to travel at her boss's behest. At a beachside Air Force base, she clashes with Capt. Andrew Jantz (Ludwig), who knows her assignment is finding reasons to defund the facility.",English,USA,https://m.media-amazon.com/images/M/MV5BZjM2MTNjNzAtMjU0Yy00MTNmLWFkMDctMWZmMjA0ODE0YTVhXkEyXkFqcGdeQXVyNjEwNTM2Mzc@._V1_SX300.jpg,N/A,tt13236566,5.9,"3,059",movie,N/A
The Untouchables,1987,R,03 Jun 1987,119 min,"Crime, Drama, Thriller",Brian De Palma,"David Mamet, Oscar Fraley (suggested by book), Eliot Ness (suggested by book)","Kevin Costner, Sean Connery, Charles Martin Smith, Andy Garcia","During the era of Prohibition in the United States, Federal Agent Eliot Ness sets out to stop ruthless Chicago gangster Al Capone and, because of rampant corruption, assembles a small, hand-picked team to help him.",English,USA,https://m.media-amazon.com/images/M/MV5BYTVjYWJmMWQtYWU4Ni00MWY3LWI2YmMtNTI5MDE0MWVmMmEzL2ltYWdlXkEyXkFqcGdeQXVyMTQxNzMzNDI@._V1_SX300.jpg,79,tt0094226,7.9,"275,953",movie,Paramount Pictures
Halloween,1978,R,27 Oct 1978,91 min,"Horror, Thriller",John Carpenter,"John Carpenter (screenplay by), Debra Hill (screenplay by)","Donald Pleasence, Jamie Lee Curtis, Nancy Kyes, P.J. Soles","Fifteen years after murdering his sister on Halloween night 1963, Michael Myers escapes from a mental hospital and returns to the small town of Haddonfield, Illinois to kill again.",English,USA,https://m.media-amazon.com/images/M/MV5BNzk1OGU2NmMtNTdhZC00NjdlLWE5YTMtZTQ0MGExZTQzOGQyXkEyXkFqcGdeQXVyMTQxNzMzNDI@._V1_SX300.jpg,87,tt0077651,7.8,"229,636",movie,Falcon Films
The Rocky Horror Picture Show,1975,R,31 Aug 1975,100 min,"Comedy, Musical",Jim Sharman,"Richard O'Brien (original musical play), Jim Sharman (screenplay), Richard O'Brien (screenplay)","Tim Curry, Susan Sarandon, Barry Bostwick, Richard O'Brien",A newly-engaged couple have a breakdown in an isolated area and must seek shelter at the bizarre residence of Dr. Frank-n-Furter.,English,"UK, USA",https://m.media-amazon.com/images/M/MV5BOGIzYjM3YzMtMjk5ZS00NDY2LTllMjEtNjYwZjhmMDNhMDBkXkEyXkFqcGdeQXVyODUzMjQxMTA@._V1_SX300.jpg,65,tt0073629,7.4,"130,148",movie,Twentieth Century Fox
The Nightmare Before Christmas,1993,PG,29 Oct 1993,76 min,"Animation, Family, Fantasy, Musical",Henry Selick,"Tim Burton (story and characters), Michael McDowell (adaptation), Caroline Thompson (screenplay)","Danny Elfman, Chris Sarandon, Catherine O'Hara, William Hickey","Jack Skellington, king of Halloween Town, discovers Christmas Town, but his attempts to bring Christmas to his home causes confusion.",English,USA,https://m.media-amazon.com/images/M/MV5BNWE4OTNiM2ItMjY4Ni00ZTViLWFiZmEtZGEyNGY2ZmNlMzIyXkEyXkFqcGdeQXVyMDU5NDcxNw@@._V1_SX300.jpg,82,tt0107688,8.0,"292,995",movie,"Touchstone Pictures, Skellington Productions"
Come Play,2020,PG-13,30 Oct 2020,96 min,"Drama, Horror, Mystery, Thriller",Jacob Chase,Jacob Chase,"Azhy Robertson, Gillian Jacobs, John Gallagher Jr., Winslow Fegley",A monster named Larry manifests itself through smart phones and mobile devices. Feature film version of the 2017 short film.,English,USA,https://m.media-amazon.com/images/M/MV5BYzI4NzU4M2EtNWI2YS00ZjdmLWIzOTQtZmFkYTg2OTlkMTk3XkEyXkFqcGdeQXVyODk4OTc3MTY@._V1_SX300.jpg,58,tt8004664,5.8,"1,725",movie,N/A
Over the Moon,2020,PG,23 Oct 2020,95 min,"Animation, Adventure, Comedy, Family, Fantasy, Musical, Sci-Fi","Glen Keane, John Kahrs(co-director)","Audrey Wells, Jennifer Yee McDevitt (additional screenplay material by), Alice Wu (additional screenplay material by)","Glen Keane, Brycen Hall, Ruthie Ann Miles, John Cho","In this animated musical, a girl builds a rocket ship and blasts off, hoping to meet a mythical moon goddess.",English,"China, USA",https://m.media-amazon.com/images/M/MV5BNTI0ZjVhM2ItMmFkOS00ZmFiLTg4NGQtODJjNTZmMDYxMWMyXkEyXkFqcGdeQXVyMDM2NDM2MQ@@._V1_SX300.jpg,60,tt7488208,6.6,"6,575",movie,N/A
Possessor Uncut,2020,R,02 Oct 2020,103 min,"Horror, Sci-Fi, Thriller",Brandon Cronenberg,Brandon Cronenberg,"Gabrielle Graham, Hanneke Talbot, Matthew Garlick, Daniel Park",Possessor follows an agent who works for a secretive organization that uses brain-implant technology to inhabit other people's bodies - ultimately driving them to commit assassinations for high-paying clients.,English,"UK, Canada",https://m.media-amazon.com/images/M/MV5BMjBlYTlhMDctNTQ3ZC00MjM4LWIxNjctNDI4NjA3NDc3Yzc5XkEyXkFqcGdeQXVyMTEyMjM2NDc2._V1_SX300.jpg,72,tt5918982,6.5,"3,936",movie,N/A
Enola Holmes,2020,PG-13,23 Sep 2020,123 min,"Adventure, Crime, Drama, Mystery",Harry Bradbeer,"Jack Thorne (screenplay by), Nancy Springer (based upon the book ""The Case of the Missing Marquess: An Enola Holmes Mystery"" by)","Millie Bobby Brown, Henry Cavill, Sam Claflin, Helena Bonham Carter","When Enola Holmes-Sherlock's teen sister-discovers her mother missing, she sets off to find her, becoming a super-sleuth in her own right as she outwits her famous brother and unravels a dangerous conspiracy around a mysterious young Lord.",English,UK,https://m.media-amazon.com/images/M/MV5BZjNkNzk0ZjEtM2M1ZC00MmMxLTlmOWEtNWRlZTc1ZTUyNzY4XkEyXkFqcGdeQXVyMTEyMjM2NDc2._V1_SX300.jpg,68,tt7846844,6.6,"86,709",movie,N/A
The Invisible Man,2020,R,28 Feb 2020,124 min,"Drama, Horror, Mystery, Sci-Fi, Thriller",Leigh Whannell,"Leigh Whannell (screenplay), Leigh Whannell (screen story)","Elisabeth Moss, Oliver Jackson-Cohen, Harriet Dyer, Aldis Hodge","When Cecilia's abusive ex takes his own life and leaves her his fortune, she suspects his death was a hoax. As a series of coincidences turn lethal, Cecilia works to prove that she is being hunted by someone nobody can see.",English,"Canada, Australia, USA",https://m.media-amazon.com/images/M/MV5BZjFhM2I4ZDYtZWMwNC00NTYzLWE3MDgtNjgxYmM3ZWMxYmVmXkEyXkFqcGdeQXVyMTkxNjUyNQ@@._V1_SX300.jpg,72,tt1051906,7.1,"146,418",movie,Indie Rights
Dr. No,1962,PG,10 Oct 1962,110 min,"Action, Adventure, Thriller",Terence Young,"Richard Maibaum (screenplay by), Johanna Harwood (screenplay by), Berkely Mather (screenplay by), Ian Fleming (based on the novel by)","Sean Connery, Ursula Andress, Joseph Wiseman, Jack Lord",A resourceful British government agent seeks answers in a case involving the disappearance of a colleague and the disruption of the American space program.,"English, French",UK,https://m.media-amazon.com/images/M/MV5BMWRkZTI4NzktYjA4Yi00ZjE0LTgzOWQtYzJlMTkyOTU1ODRmXkEyXkFqcGdeQXVyNDY2MTk1ODk@._V1_SX300.jpg,78,tt0055928,7.2,"146,342",movie,Danjaq Productions
The Devil All the Time,2020,R,16 Sep 2020,138 min,"Crime, Drama, Thriller",Antonio Campos,"Antonio Campos (screenplay by), Paulo Campos (screenplay by), Donald Ray Pollock (based on the novel by)","Donald Ray Pollock, Bill Skarsgård, Tom Holland, Michael Banks Repeta",Sinister characters converge around a young man devoted to protecting those he loves in a postwar backwoods town teeming with corruption and brutality.,English,USA,https://m.media-amazon.com/images/M/MV5BZmE1NmVmN2EtMjZmZC00YzAyLWE4MWEtYjY5YmExMjUxODU1XkEyXkFqcGdeQXVyMTkxNjUyNQ@@._V1_SX300.jpg,55,tt7395114,7.1,"70,511",movie,N/A
The Addams Family,1991,PG-13,22 Nov 1991,99 min,"Comedy, Fantasy",Barry Sonnenfeld,"Charles Addams (characters), Caroline Thompson, Larry Wilson","Anjelica Huston, Raul Julia, Christopher Lloyd, Dan Hedaya",Con artists plan to fleece an eccentric family using an accomplice who claims to be their long-lost uncle.,"English, Italian, French",USA,https://m.media-amazon.com/images/M/MV5BODc1NmY0MDUtNjUzNS00ODdhLWJlN2ItMTgwZjczZjI0MDkyXkEyXkFqcGdeQXVyNTAyODkwOQ@@._V1_SX300.jpg,57,tt0101272,6.9,"130,478",movie,"Paramount Pictures, Orion Pictures"
The Rock,1996,R,07 Jun 1996,136 min,"Action, Adventure, Thriller",Michael Bay,"David Weisberg (story), Douglas Cook (story), David Weisberg (screenplay), Douglas Cook (screenplay), Mark Rosner (screenplay)","Sean Connery, Nicolas Cage, Ed Harris, John Spencer","A mild-mannered chemist and an ex-con must lead the counterstrike when a rogue group of military men, led by a renegade general, threaten a nerve gas attack from Alcatraz against San Francisco.",English,USA,https://m.media-amazon.com/images/M/MV5BZDJjOTE0N2EtMmRlZS00NzU0LWE0ZWQtM2Q3MWMxNjcwZjBhXkEyXkFqcGdeQXVyNDk3NzU2MTQ@._V1_SX300.jpg,58,tt0117500,7.4,"308,131",movie,"Hollywood Pictures, Don Simpson/Jerry Bruckheimer Films"
Borat: Cultural Learnings of America for Make Benefit Glorious Nation of Kazakhstan,2006,R,03 Nov 2006,84 min,Comedy,Larry Charles,"Sacha Baron Cohen (screenplay), Anthony Hines (screenplay), Peter Baynham (screenplay), Dan Mazer (screenplay), Sacha Baron Cohen (story), Peter Baynham (story), Anthony Hines (story), Todd Phillips (story), Sacha Baron Cohen (based on a character created by)","Sacha Baron Cohen, Ken Davitian, Luenell, Chester","Kazakh TV talking head Borat is dispatched to the United States to report on the greatest country in the world. With a documentary crew in tow, Borat becomes more interested in locating and marrying Pamela Anderson.","English, Romanian, Hebrew, Polish, Armenian","USA, UK",https://m.media-amazon.com/images/M/MV5BMTk0MTQ3NDQ4Ml5BMl5BanBnXkFtZTcwOTQ3OTQzMw@@._V1_SX300.jpg,89,tt0443453,7.3,"353,502",movie,Gold/Miller Productions
Zardoz,1974,R,06 Feb 1974,105 min,"Adventure, Fantasy, Sci-Fi",John Boorman,John Boorman,"Sean Connery, Charlotte Rampling, Sara Kestelman, John Alderton","In the distant future, a savage trained only to kill finds a way into the community of bored immortals that alone preserves humanity's achievements.","English, Italian, Swedish, Latin, German, French, Irish","UK, USA, Ireland",https://m.media-amazon.com/images/M/MV5BMDg5NTYzNzMtNzhmOS00NzEyLWJlMWMtMzUzNjdhYjY2NDI3XkEyXkFqcGdeQXVyNjUwMzI2NzU@._V1_SX300.jpg,46,tt0070948,5.9,"19,366",movie,John Boorman Productions
Hereditary,2018,R,08 Jun 2018,127 min,"Drama, Horror, Mystery, Thriller",Ari Aster,Ari Aster,"Alex Wolff, Gabriel Byrne, Toni Collette, Milly Shapiro",A grieving family is haunted by tragic and disturbing occurrences.,"English, Spanish",USA,https://m.media-amazon.com/images/M/MV5BOTU5MDg3OGItZWQ1Ny00ZGVmLTg2YTUtMzBkYzQ1YWIwZjlhXkEyXkFqcGdeQXVyNTAzMTY4MDA@._V1_SX300.jpg,87,tt7784604,7.3,"231,087",movie,PalmStar Media
It,2017,R,08 Sep 2017,135 min,Horror,Andy Muschietti,"Chase Palmer (screenplay by), Cary Joji Fukunaga (screenplay by), Gary Dauberman (screenplay by), Stephen King (based on the novel by)","Jaeden Martell, Jeremy Ray Taylor, Sophia Lillis, Finn Wolfhard","In the summer of 1989, a group of bullied kids band together to destroy a shape-shifting monster, which disguises itself as a clown and preys on the children of Derry, their small Maine town.","English, Hebrew","Canada, USA",https://m.media-amazon.com/images/M/MV5BZDVkZmI0YzAtNzdjYi00ZjhhLWE1ODEtMWMzMWMzNDA0NmQ4XkEyXkFqcGdeQXVyNzYzODM3Mzg@._V1_SX300.jpg,69,tt1396484,7.3,"450,627",movie,"Vertigo Entertainment, RatPac-Dune Entertainment, Lin Pictures"
Emma,1996,PG,30 Aug 1996,120 min,"Comedy, Drama, Romance",Douglas McGrath,"Jane Austen (novel), Douglas McGrath (screenplay)","Gwyneth Paltrow, James Cosmo, Greta Scacchi, Alan Cumming","While matchmaking for friends and neighbours, a young 19th Century Englishwoman nearly misses her own chance at love.",English,"UK, USA",https://m.media-amazon.com/images/M/MV5BN2E1YTUzZDAtODQ2YS00MWNjLWEzMzAtZjgwY2M3ZTcwOTJhXkEyXkFqcGdeQXVyNjE5MjUyOTM@._V1_SX300.jpg,66,tt0116191,6.6,"35,311",movie,"A&amp;E Television Networks, Meridian Broadcasting, Chestermead"
The New Mutants,2020,PG-13,28 Aug 2020,94 min,"Action, Horror, Sci-Fi",Josh Boone,"Josh Boone, Knate Lee","Maisie Williams, Anya Taylor-Joy, Charlie Heaton, Alice Braga","Five young mutants, just discovering their abilities while held in a secret facility against their will, fight to escape their past sins and save themselves.",English,USA,https://m.media-amazon.com/images/M/MV5BZDQ2NTdmNDgtMGIwMS00ODE2LTk5M2EtZGZhYzc4MWRlNTU3XkEyXkFqcGdeQXVyNTc4MjczMTM@._V1_SX300.jpg,43,tt4682266,5.5,"13,285",movie,"20th Century Fox, Donners&#39; Company"
The Gentlemen,2019,R,24 Jan 2020,113 min,"Action, Comedy, Crime",Guy Ritchie,"Guy Ritchie (story by), Ivan Atkinson (story by), Marn Davies (story by), Guy Ritchie (screenplay by)","Matthew McConaughey, Charlie Hunnam, Michelle Dockery, Jeremy Strong","An American expat tries to sell off his highly profitable marijuana empire in London, triggering plots, schemes, bribery and blackmail in an attempt to steal his domain out from under him.",English,"UK, USA",https://m.media-amazon.com/images/M/MV5BMTlkMmVmYjktYTc2NC00ZGZjLWEyOWUtMjc2MDMwMjQwOTA5XkEyXkFqcGdeQXVyNTI4MzE4MDU@._V1_SX300.jpg,51,tt8367814,7.8,"202,260",movie,N/A
365 Days,2020,TV-MA,07 Feb 2020,114 min,"Drama, Romance","Barbara Bialowas, Tomasz Mandes","Tomasz Klimala (screenplay by), Tomasz Mandes (screen story by), Barbara Bialowas (screen story by), Blanka Lipinska (screen story by), Blanka Lipinska (based on the novel by)","Anna Maria Sieklucka, Michele Morrone, Bronislaw Wroclawski, Otar Saralidze","Massimo is a member of the Sicilian Mafia family and Laura is a sales director. She does not expect that on a trip to Sicily trying to save her relationship, Massimo will kidnap her and give her 365 days to fall in love with him.","Polish, English, Italian",Poland,https://m.media-amazon.com/images/M/MV5BODljZTM3ODAtMDc0YS00NmI4LTlmZTUtM2I5MDAzNTQxZmMxXkEyXkFqcGdeQXVyMTEwMTY3NDI@._V1_SX300.jpg,N/A,tt10886166,3.3,"41,140",movie,N/A
The League of Extraordinary Gentlemen,2003,PG-13,11 Jul 2003,110 min,"Action, Adventure, Fantasy, Sci-Fi",Stephen Norrington,"Alan Moore (comic books), Kevin O'Neill (comic books), James Robinson (screenplay)","Sean Connery, Naseeruddin Shah, Peta Wilson, Tony Curran","In an alternate Victorian Age world, a group of famous contemporary fantasy, science fiction, and adventure characters team up on a secret mission.","English, German, Italian","USA, Germany, Czech Republic, UK",https://m.media-amazon.com/images/M/MV5BZTFlOTdkMjEtNGVmMS00YTA3LThlNjQtMjAzZmFjZDAzNjllL2ltYWdlL2ltYWdlXkEyXkFqcGdeQXVyMTQxNzMzNDI@._V1_SX300.jpg,30,tt0311429,5.8,"166,015",movie,20th Century Fox
Spell,2018,N/A,01 Nov 2019,87 min,"Comedy, Drama, Thriller",Brendan Walter,"Barak Hardley (story), Barak Hardley, Jon Lullo (story), Brendan Walter (story)","Barak Hardley, Jackie Tohn, Magnús Jónsson, Birna Rún Eiríksdóttir","After the death of his fiancée, an American illustrator runs out of medication while wandering the isolated Icelandic countryside - unsure if his compulsions are related to his disorder or if he's being forced to unlock ancient secrets.",English,USA,https://m.media-amazon.com/images/M/MV5BZDBmM2VlZWUtODAxMC00NjZmLWEzMzMtMmQzN2FjZWEyZTI0XkEyXkFqcGdeQXVyMTA5MTkwODY@._V1_SX300.jpg,63,tt6398496,5.9,402,movie,N/A
