Rank,Title,Year,Rated,Released,Runtime,Director,Plot,Poster,Metascore,imdbID,imdbRating,imdbVotes,Type
69,Princess Mononoke,1997,PG-13,19 Dec 1997,134 min,Hayao Miyazaki,"On a journey to find the cure for a Tatarigami's curse, Ashitaka finds himself in the middle of a war between the forest gods and Tatara, a mining colony. In this quest he also meets San, the Mononoke Hime.",https://m.media-amazon.com/images/M/MV5BNGIzY2IzODQtNThmMi00ZDE4LWI5YzAtNzNlZTM1ZjYyYjUyXkEyXkFqcGdeQXVyODEzNjM5OTQ@._V1_SX300.jpg,76,tt0119698,8.4,"334,709",movie
70,Dr. Strangelove or: How I Learned to Stop Worrying and Love the Bomb,1964,PG,29 Jan 1964,95 min,Stanley Kubrick,An insane general triggers a path to nuclear holocaust that a War Room full of politicians and generals frantically tries to stop.,https://m.media-amazon.com/images/M/MV5BZWI3ZTMxNjctMjdlNS00NmUwLWFiM2YtZDUyY2I3N2MxYTE0XkEyXkFqcGdeQXVyNzkwMjQ5NzM@._V1_SX300.jpg,97,tt0057012,8.4,"444,929",movie
71,The Dark Knight Rises,2012,PG-13,20 Jul 2012,164 min,Christopher Nolan,"Eight years after the Joker's reign of anarchy, Batman, with the help of the enigmatic Catwoman, is forced from his exile to save Gotham City from the brutal guerrilla terrorist Bane.",https://m.media-amazon.com/images/M/MV5BMTk4ODQzNDY3Ml5BMl5BanBnXkFtZTcwODA0NTM4Nw@@._V1_SX300.jpg,78,tt1345836,8.4,"1,493,961",movie
72,Once Upon a Time in America,1984,R,01 Jun 1984,229 min,Sergio Leone,"A former Prohibition-era Jewish gangster returns to the Lower East Side of Manhattan over thirty years later, where he once again must confront the ghosts and regrets of his old life.",https://m.media-amazon.com/images/M/MV5BMGFkNWI4MTMtNGQ0OC00MWVmLTk3MTktOGYxN2Y2YWVkZWE2XkEyXkFqcGdeQXVyNjU0OTQ0OTY@._V1_SX300.jpg,N/A,tt0087843,8.4,"305,931",movie
73,Aliens,1986,R,18 Jul 1986,137 min,James Cameron,"Ellen Ripley is rescued by a deep salvage team after being in hypersleep for 57 years. The moon that the Nostromo visited has been colonized, but contact is lost. This time, colonial marines have impressive firepower, but will that be enough?",https://m.media-amazon.com/images/M/MV5BZGU2OGY5ZTYtMWNhYy00NjZiLWI0NjUtZmNhY2JhNDRmODU3XkEyXkFqcGdeQXVyNzkwMjQ5NzM@._V1_SX300.jpg,84,tt0090605,8.3,"644,709",movie
74,Call Me by Your Name,2017,R,19 Jan 2018,132 min,Luca Guadagnino,"In 1980s Italy, romance blossoms between a seventeen-year-old student and the older man hired as his father's research assistant.",https://m.media-amazon.com/images/M/MV5BNDk3NTEwNjc0MV5BMl5BanBnXkFtZTgwNzYxNTMwMzI@._V1_SX300.jpg,93,tt5726616,7.9,"204,516",movie
75,Avengers: Endgame,2019,PG-13,26 Apr 2019,181 min,"Anthony Russo, Joe Russo","After the devastating events of Avengers: Infinity War (2018), the universe is in ruins. With the help of remaining allies, the Avengers assemble once more in order to reverse Thanos' actions and restore balance to the universe.",https://m.media-amazon.com/images/M/MV5BMTc5MDE2ODcwNV5BMl5BanBnXkFtZTgwMzI2NzQ2NzM@._V1_SX300.jpg,78,tt4154796,8.4,"772,522",movie
76,Coco,2017,PG,22 Nov 2017,105 min,"Lee Unkrich, Adrian Molina(co-director)","Aspiring musician Miguel, confronted with his family's ancestral ban on music, enters the Land of the Dead to find his great-great-grandfather, a legendary singer.",https://m.media-amazon.com/images/M/MV5BYjQ5NjM0Y2YtNjZkNC00ZDhkLWJjMWItN2QyNzFkMDE3ZjAxXkEyXkFqcGdeQXVyODIxMzk5NjA@._V1_SX300.jpg,81,tt2380307,8.4,"363,183",movie
77,American Beauty,1999,R,01 Oct 1999,122 min,Sam Mendes,A sexually frustrated suburban father has a mid-life crisis after becoming infatuated with his daughter's best friend.,https://m.media-amazon.com/images/M/MV5BNTBmZWJkNjctNDhiNC00MGE2LWEwOTctZTk5OGVhMWMyNmVhXkEyXkFqcGdeQXVyMTMxODk2OTU@._V1_SX300.jpg,84,tt0169547,8.3,"1,057,345",movie
78,Braveheart,1995,R,24 May 1995,178 min,Mel Gibson,Scottish warrior William Wallace leads his countrymen in a rebellion to free his homeland from the tyranny of King Edward I of England.,https://m.media-amazon.com/images/M/MV5BMzkzMmU0YTYtOWM3My00YzBmLWI0YzctOGYyNTkwMWE5MTJkXkEyXkFqcGdeQXVyNzkwMjQ5NzM@._V1_SX300.jpg,68,tt0112573,8.3,"948,469",movie
79,3 Idiots,2009,PG-13,25 Dec 2009,170 min,Rajkumar Hirani,"Two friends are searching for their long lost companion. They revisit their college days and recall the memories of their friend who inspired them to think differently, even as the rest of the world called them ""idiots"".",https://m.media-amazon.com/images/M/MV5BNTkyOGVjMGEtNmQzZi00NzFlLTlhOWQtODYyMDc2ZGJmYzFhXkEyXkFqcGdeQXVyNjU0OTQ0OTY@._V1_SX300.jpg,67,tt1187043,8.4,"336,994",movie
80,Das Boot,1981,R,10 Feb 1982,149 min,Wolfgang Petersen,"The claustrophobic world of a WWII German U-boat; boredom, filth and sheer terror.",https://m.media-amazon.com/images/M/MV5BOGZhZDIzNWMtNjkxMS00MDQ1LThkMTYtZWQzYWU3MWMxMGU5XkEyXkFqcGdeQXVyNjc1NTYyMjg@._V1_SX300.jpg,86,tt0082096,8.3,"228,281",movie
81,Toy Story,1995,G,22 Nov 1995,81 min,John Lasseter,A cowboy doll is profoundly threatened and jealous when a new spaceman figure supplants him as top toy in a boy's room.,https://m.media-amazon.com/images/M/MV5BMDU2ZWJlMjktMTRhMy00ZTA5LWEzNDgtYmNmZTEwZTViZWJkXkEyXkFqcGdeQXVyNDQ2OTk4MzI@._V1_SX300.jpg,95,tt0114709,8.3,"872,524",movie
82,Tengoku to jigoku,2007,N/A,08 Sep 2007,N/A,Yasuo Tsuruhashi,N/A,N/A,N/A,tt1067255,5.3,6,movie
83,,,,,,,,,,,,,
84,Amadeus,1984,R,19 Sep 1984,160 min,Milos Forman,"The life, success and troubles of Wolfgang Amadeus Mozart, as told by Antonio Salieri, the contemporaneous composer who was insanely jealous of Mozart's talent and claimed to have murdered him.",https://m.media-amazon.com/images/M/MV5BNWJlNzUzNGMtYTAwMS00ZjI2LWFmNWQtODcxNWUxODA5YmU1XkEyXkFqcGdeQXVyNTIzOTk5ODM@._V1_SX300.jpg,88,tt0086879,8.3,"364,261",movie
85,Inglourious Basterds,2009,R,21 Aug 2009,153 min,Quentin Tarantino,"In Nazi-occupied France during World War II, a plan to assassinate Nazi leaders by a group of Jewish U.S. soldiers coincides with a theatre owner's vengeful plans for the same.",https://m.media-amazon.com/images/M/MV5BOTJiNDEzOWYtMTVjOC00ZjlmLWE0NGMtZmE1OWVmZDQ2OWJhXkEyXkFqcGdeQXVyNTIzOTk5ODM@._V1_SX300.jpg,69,tt0361748,8.3,"1,243,671",movie
86,Star Wars: Episode VI - Return of the Jedi,1983,PG,25 May 1983,131 min,Richard Marquand,"After a daring mission to rescue Han Solo from Jabba the Hutt, the Rebels dispatch to Endor to destroy the second Death Star. Meanwhile, Luke struggles to help Darth Vader back from the dark side without falling into the Emperor's trap.",https://m.media-amazon.com/images/M/MV5BOWZlMjFiYzgtMTUzNC00Y2IzLTk1NTMtZmNhMTczNTk0ODk1XkEyXkFqcGdeQXVyNTAyODkwOQ@@._V1_SX300.jpg,58,tt0086190,8.3,"936,076",movie
87,Like Stars on Earth,2007,PG,21 Dec 2007,165 min,"Aamir Khan, Amole Gupte","An eight-year-old boy is thought to be a lazy trouble-maker, until the new art teacher has the patience and compassion to discover the real problem behind his struggles in school.",https://m.media-amazon.com/images/M/MV5BMDhjZWViN2MtNzgxOS00NmI4LThiZDQtZDI3MzM4MDE4NTc0XkEyXkFqcGdeQXVyMTMxODk2OTU@._V1_SX300.jpg,N/A,tt0986264,8.4,"164,618",movie
88,Good Will Hunting,1997,R,09 Jan 1998,126 min,Gus Van Sant,"Will Hunting, a janitor at M.I.T., has a gift for mathematics, but needs help from a psychologist to find direction in his life.",https://m.media-amazon.com/images/M/MV5BOTI0MzcxMTYtZDVkMy00NjY1LTgyMTYtZmUxN2M3NmQ2NWJhXkEyXkFqcGdeQXVyMTQxNzMzNDI@._V1_SX300.jpg,70,tt0119217,8.3,"846,117",movie
89,Reservoir Dogs,1992,R,02 Sep 1992,99 min,Quentin Tarantino,"When a simple jewelry heist goes horribly wrong, the surviving criminals begin to suspect that one of them is a police informant.",https://m.media-amazon.com/images/M/MV5BZmExNmEwYWItYmQzOS00YjA5LTk2MjktZjEyZDE1Y2QxNjA1XkEyXkFqcGdeQXVyMTQxNzMzNDI@._V1_SX300.jpg,79,tt0105236,8.3,"905,393",movie
90,2001: A Space Odyssey,1968,G,12 May 1968,149 min,Stanley Kubrick,"After discovering a mysterious artifact buried beneath the Lunar surface, mankind sets off on a quest to find its origins with help from intelligent supercomputer H.A.L. 9000.",https://m.media-amazon.com/images/M/MV5BMmNlYzRiNDctZWNhMi00MzI4LThkZTctMTUzMmZkMmFmNThmXkEyXkFqcGdeQXVyNzkwMjQ5NzM@._V1_SX300.jpg,84,tt0062622,8.3,"594,224",movie
91,Requiem for a Dream,2000,R,15 Dec 2000,102 min,Darren Aronofsky,The drug-induced utopias of four Coney Island people are shattered when their addictions run deep.,https://m.media-amazon.com/images/M/MV5BOTdiNzJlOWUtNWMwNS00NmFlLWI0YTEtZmI3YjIzZWUyY2Y3XkEyXkFqcGdeQXVyNjU0OTQ0OTY@._V1_SX300.jpg,68,tt0180093,8.3,"755,242",movie
92,Vertigo,1958,PG,22 May 1958,128 min,Alfred Hitchcock,A former police detective juggles wrestling with his personal demons and becoming obsessed with a hauntingly beautiful woman.,https://m.media-amazon.com/images/M/MV5BYTE4ODEwZDUtNDFjOC00NjAxLWEzYTQtYTI1NGVmZmFlNjdiL2ltYWdlL2ltYWdlXkEyXkFqcGdeQXVyNjc1NTYyMjg@._V1_SX300.jpg,100,tt0052357,8.3,"356,662",movie
93,Dial M for Murder,1954,PG,29 May 1954,105 min,Alfred Hitchcock,A former tennis player tries to arrange his wife's murder after learning of her affair.,https://m.media-amazon.com/images/M/MV5BOWIwODIxYWItZDI4MS00YzhhLWE3MmYtMzlhZDIwOTMzZmE5L2ltYWdlXkEyXkFqcGdeQXVyNjc1NTYyMjg@._V1_SX300.jpg,75,tt0046912,8.2,"155,480",movie
94,Eternal Sunshine of the Spotless Mind,2004,R,19 Mar 2004,108 min,Michel Gondry,"When their relationship turns sour, a couple undergoes a medical procedure to have each other erased from their memories.",https://m.media-amazon.com/images/M/MV5BMTY4NzcwODg3Nl5BMl5BanBnXkFtZTcwNTEwOTMyMw@@._V1_SX300.jpg,89,tt0338013,8.3,"895,931",movie
95,Dangal,2016,Not Rated,21 Dec 2016,161 min,Nitesh Tiwari,Former wrestler Mahavir Singh Phogat and his two wrestler daughters struggle towards glory at the Commonwealth Games in the face of societal oppression.,https://m.media-amazon.com/images/M/MV5BMTQ4MzQzMzM2Nl5BMl5BanBnXkFtZTgwMTQ1NzU3MDI@._V1_SX300.jpg,N/A,tt5074352,8.4,"151,322",movie
96,The Hunt,2012,R,10 Jan 2013,115 min,Thomas Vinterberg,"A teacher lives a lonely life, all the while struggling over his son's custody. His life slowly gets better as he finds love and receives good news from his son, but his new luck is about to be brutally shattered by an innocent little lie.",https://m.media-amazon.com/images/M/MV5BNDM2MzMwMzcxNF5BMl5BanBnXkFtZTcwNTczMDk3OA@@._V1_SX300.jpg,77,tt2106476,8.3,"273,815",movie
97,Citizen Kane,1941,PG,05 Sep 1941,119 min,Orson Welles,"Following the death of publishing tycoon Charles Foster Kane, reporters scramble to uncover the meaning of his final utterance; 'Rosebud'.",https://m.media-amazon.com/images/M/MV5BYjBiOTYxZWItMzdiZi00NjlkLWIzZTYtYmFhZjhiMTljOTdkXkEyXkFqcGdeQXVyNzkwMjQ5NzM@._V1_SX300.jpg,100,tt0033467,8.3,"393,158",movie
98,1917,2019,R,10 Jan 2020,119 min,Sam Mendes,"April 6th, 1917. As a regiment assembles to wage war deep in enemy territory, two soldiers are assigned to race against time and deliver a message that will stop 1,600 men from walking straight into a deadly trap.",https://m.media-amazon.com/images/M/MV5BOTdmNTFjNDEtNzg0My00ZjkxLTg1ZDAtZTdkMDc2ZmFiNWQ1XkEyXkFqcGdeQXVyNTAzNzgwNTg@._V1_SX300.jpg,78,tt8579674,8.3,"386,483",movie
99,Full Metal Jacket,1987,R,10 Jul 1987,116 min,Stanley Kubrick,A pragmatic U.S. Marine observes the dehumanizing effects the Vietnam War has on his fellow recruits from their brutal boot camp training to the bloody street fighting in Hue.,https://m.media-amazon.com/images/M/MV5BNzkxODk0NjEtYjc4Mi00ZDI0LTgyYjEtYzc1NDkxY2YzYTgyXkEyXkFqcGdeQXVyNzkwMjQ5NzM@._V1_SX300.jpg,76,tt0093058,8.3,"662,791",movie
100,Bicycle Thieves,1948,Not Rated,13 Dec 1949,89 min,Vittorio De Sica,"In post-war Italy, a working-class man's bicycle is stolen. He and his son set out to find it.",https://m.media-amazon.com/images/M/MV5BNmI1ODdjODctMDlmMC00ZWViLWI5MzYtYzRhNDdjYmM3MzFjXkEyXkFqcGdeQXVyMTMxODk2OTU@._V1_SX300.jpg,N/A,tt0040522,8.3,"143,235",movie
101,The Kid,1921,Passed,06 Feb 1921,68 min,Charles Chaplin,"The Tramp cares for an abandoned child, but events put that relationship in jeopardy.",https://m.media-amazon.com/images/M/MV5BZjhhMThhNDItNTY2MC00MmU1LTliNDEtNDdhZjdlNTY5ZDQ1XkEyXkFqcGdeQXVyNjc1NTYyMjg@._V1_SX300.jpg,N/A,tt0012349,8.3,"110,963",movie
102,Singin' in the Rain,1952,G,11 Apr 1952,103 min,"Stanley Donen, Gene Kelly",A silent film production company and cast make a difficult transition to sound.,https://m.media-amazon.com/images/M/MV5BZDRjNGViMjQtOThlMi00MTA3LThkYzQtNzJkYjBkMGE0YzE1XkEyXkFqcGdeQXVyNDYyMDk5MTU@._V1_SX300.jpg,99,tt0045152,8.3,"214,463",movie
103,A Clockwork Orange,1971,R,02 Feb 1972,136 min,Stanley Kubrick,"In the future, a sadistic gang leader is imprisoned and volunteers for a conduct-aversion experiment, but it doesn't go as planned.",https://m.media-amazon.com/images/M/MV5BMTY3MjM1Mzc4N15BMl5BanBnXkFtZTgwODM0NzAxMDE@._V1_SX300.jpg,77,tt0066921,8.3,"745,406",movie
104,North by Northwest,1959,Approved,18 Dec 1959,136 min,Alfred Hitchcock,A New York City advertising executive goes on the run after being mistaken for a government agent by a group of foreign spies.,https://m.media-amazon.com/images/M/MV5BZDA3NDExMTUtMDlhOC00MmQ5LWExZGUtYmI1NGVlZWI4OWNiXkEyXkFqcGdeQXVyNjc1NTYyMjg@._V1_SX300.jpg,98,tt0053125,8.3,"294,945",movie
105,Snatch,2000,R,19 Jan 2001,102 min,Guy Ritchie,"Unscrupulous boxing promoters, violent bookmakers, a Russian gangster, incompetent amateur robbers and supposedly Jewish jewelers fight to track down a priceless stolen diamond.",https://m.media-amazon.com/images/M/MV5BMTA2NDYxOGYtYjU1Mi00Y2QzLTgxMTQtMWI1MGI0ZGQ5MmU4XkEyXkFqcGdeQXVyNDk3NzU2MTQ@._V1_SX300.jpg,55,tt0208092,8.3,"772,625",movie
106,Scarface,1983,R,09 Dec 1983,170 min,Brian De Palma,"In 1980 Miami, a determined Cuban immigrant takes over a drug cartel and succumbs to greed.",https://m.media-amazon.com/images/M/MV5BNjdjNGQ4NDEtNTEwYS00MTgxLTliYzQtYzE2ZDRiZjFhZmNlXkEyXkFqcGdeQXVyNjU0OTQ0OTY@._V1_SX300.jpg,65,tt0086250,8.3,"729,013",movie
107,Taxi Driver,1976,R,09 Feb 1976,114 min,Martin Scorsese,"A mentally unstable veteran works as a nighttime taxi driver in New York City, where the perceived decadence and sleaze fuels his urge for violent action by attempting to liberate a presidential campaign worker and an underage prostitute.",https://m.media-amazon.com/images/M/MV5BM2M1MmVhNDgtNmI0YS00ZDNmLTkyNjctNTJiYTQ2N2NmYzc2XkEyXkFqcGdeQXVyNzkwMjQ5NzM@._V1_SX300.jpg,94,tt0075314,8.3,"711,876",movie
108,Ikiru,1952,Not Rated,25 Mar 1956,143 min,Akira Kurosawa,A bureaucrat tries to find a meaning in his life after he discovers he has terminal cancer.,https://m.media-amazon.com/images/M/MV5BZmM0NGY3Y2MtMTA1YS00YmQzLTk2YTctYWFhMDkzMDRjZWQzXkEyXkFqcGdeQXVyNTA4NzY1MzY@._V1_SX300.jpg,N/A,tt0044741,8.3,"66,054",movie
109,Amélie,2001,R,08 Feb 2002,122 min,Jean-Pierre Jeunet,"Amélie is an innocent and naive girl in Paris with her own sense of justice. She decides to help those around her and, along the way, discovers love.",https://m.media-amazon.com/images/M/MV5BNDg4NjM1YjMtYmNhZC00MjM0LWFiZmYtNGY1YjA3MzZmODc5XkEyXkFqcGdeQXVyNDk3NzU2MTQ@._V1_SX300.jpg,69,tt0211915,8.3,"694,570",movie
110,Lawrence of Arabia,1962,Approved,11 Dec 1962,228 min,David Lean,"The story of T.E. Lawrence, the English officer who successfully united and led the diverse, often warring, Arab tribes during World War I in order to fight the Turks.",https://m.media-amazon.com/images/M/MV5BYWY5ZjhjNGYtZmI2Ny00ODM0LWFkNzgtZmI1YzA2N2MxMzA0XkEyXkFqcGdeQXVyNjUwNzk3NDc@._V1_SX300.jpg,100,tt0056172,8.3,"263,382",movie
111,Toy Story 3,2010,G,18 Jun 2010,103 min,Lee Unkrich,"The toys are mistakenly delivered to a day-care center instead of the attic right before Andy leaves for college, and it's up to Woody to convince the other toys that they weren't abandoned and to return home.",https://m.media-amazon.com/images/M/MV5BMTgxOTY4Mjc0MF5BMl5BanBnXkFtZTcwNTA4MDQyMw@@._V1_SX300.jpg,92,tt0435761,8.3,"746,578",movie
112,The Sting,1973,PG,25 Dec 1973,129 min,George Roy Hill,Two grifters team up to pull off the ultimate con.,https://m.media-amazon.com/images/M/MV5BNGU3NjQ4YTMtZGJjOS00YTQ3LThmNmItMTI5MDE2ODI3NzY3XkEyXkFqcGdeQXVyMjUzOTY1NTc@._V1_SX300.jpg,83,tt0070735,8.3,"237,348",movie
113,Metropolis,1927,Not Rated,13 Mar 1927,153 min,Fritz Lang,"In a futuristic city sharply divided between the working class and the city planners, the son of the city's mastermind falls in love with a working class prophet who predicts the coming of a savior to mediate their differences.",https://m.media-amazon.com/images/M/MV5BMTg5YWIyMWUtZDY5My00Zjc1LTljOTctYmI0MWRmY2M2NmRkXkEyXkFqcGdeQXVyMTMxODk2OTU@._V1_SX300.jpg,98,tt0017136,8.3,"157,137",movie
114,A Separation,2011,PG-13,16 Mar 2011,123 min,Asghar Farhadi,A married couple are faced with a difficult decision - to improve the life of their child by moving to another country or to stay in Iran and look after a deteriorating parent who has Alzheimer's disease.,https://m.media-amazon.com/images/M/MV5BN2JmMjViMjMtZTM5Mi00ZGZkLTk5YzctZDg5MjFjZDE4NjNkXkEyXkFqcGdeQXVyMTMxODk2OTU@._V1_SX300.jpg,95,tt1832382,8.3,"216,165",movie
115,Incendies,2010,R,12 Jan 2011,131 min,Denis Villeneuve,Twins journey to the Middle East to discover their family history and fulfill their mother's last wishes.,https://m.media-amazon.com/images/M/MV5BMWE3MGYzZjktY2Q5Mi00Y2NiLWIyYWUtMmIyNzA3YmZlMGFhXkEyXkFqcGdeQXVyMTMxODk2OTU@._V1_SX300.jpg,80,tt1255953,8.3,"145,646",movie
116,,,,,,,,,,,,,
117,For a Few Dollars More,1965,R,10 May 1967,132 min,Sergio Leone,Two bounty hunters with the same intentions team up to track down a Western outlaw.,https://m.media-amazon.com/images/M/MV5BNWM1NmYyM2ItMTFhNy00NDU0LThlYWUtYjQyYTJmOTY0ZmM0XkEyXkFqcGdeQXVyNjU0OTQ0OTY@._V1_SX300.jpg,74,tt0059578,8.3,"229,110",movie
118,The Apartment,1960,Approved,29 Jun 1960,125 min,Billy Wilder,"A man tries to rise in his company by letting its executives use his apartment for trysts, but complications and a romance of his own ensue.",https://m.media-amazon.com/images/M/MV5BNzkwODFjNzItMmMwNi00MTU5LWE2MzktM2M4ZDczZGM1MmViXkEyXkFqcGdeQXVyNDY2MTk1ODk@._V1_SX300.jpg,94,tt0053604,8.3,"161,339",movie
119,Double Indemnity,1944,Passed,06 Jul 1944,107 min,Billy Wilder,An insurance representative lets himself be talked by a seductive housewife into a murder/insurance fraud scheme that arouses the suspicion of an insurance investigator.,https://m.media-amazon.com/images/M/MV5BOTdlNjgyZGUtOTczYi00MDdhLTljZmMtYTEwZmRiOWFkYjRhXkEyXkFqcGdeQXVyNDY2MTk1ODk@._V1_SX300.jpg,95,tt0036775,8.3,"140,258",movie
120,To Kill a Mockingbird,1962,Approved,16 Mar 1963,129 min,Robert Mulligan,"Atticus Finch, a lawyer in the Depression-era South, defends a black man against an undeserved rape charge, and his children against prejudice.",https://m.media-amazon.com/images/M/MV5BNmVmYzcwNzMtMWM1NS00MWIyLThlMDEtYzUwZDgzODE1NmE2XkEyXkFqcGdeQXVyNzkwMjQ5NzM@._V1_SX300.jpg,88,tt0056592,8.2,"290,412",movie
121,Up,2009,PG,29 May 2009,96 min,"Pete Docter, Bob Peterson(co-director)","78-year-old Carl Fredricksen travels to Paradise Falls in his house equipped with balloons, inadvertently taking a young stowaway.",https://m.media-amazon.com/images/M/MV5BMTk3NDE2NzI4NF5BMl5BanBnXkFtZTgwNzE1MzEyMTE@._V1_SX300.jpg,88,tt1049413,8.2,"917,982",movie
122,Indiana Jones and the Last Crusade,1989,PG-13,24 May 1989,127 min,Steven Spielberg,"In 1938, after his father Professor Henry Jones, Sr. goes missing while pursuing the Holy Grail, Professor Henry ""Indiana"" Jones, Jr. finds himself up against Adolf Hitler's Nazis again to stop them from obtaining its powers.",https://m.media-amazon.com/images/M/MV5BMjNkMzc2N2QtNjVlNS00ZTk5LTg0MTgtODY2MDAwNTMwZjBjXkEyXkFqcGdeQXVyNDk3NzU2MTQ@._V1_SX300.jpg,65,tt0097576,8.2,"681,147",movie
123,Heat,1995,R,15 Dec 1995,170 min,Michael Mann,A group of professional bank robbers start to feel the heat from police when they unknowingly leave a clue at their latest heist.,https://m.media-amazon.com/images/M/MV5BNGMwNzUwNjYtZWM5NS00YzMyLWI4NjAtNjM0ZDBiMzE1YWExXkEyXkFqcGdeQXVyNDk3NzU2MTQ@._V1_SX300.jpg,76,tt0113277,8.2,"568,209",movie
124,L.A. Confidential,1997,R,19 Sep 1997,138 min,Curtis Hanson,"As corruption grows in 1950s Los Angeles, three policemen - one strait-laced, one brutal, and one sleazy - investigate a series of murders with their own brand of justice.",https://m.media-amazon.com/images/M/MV5BMDQ2YzEyZGItYWRhOS00MjBmLTkzMDUtMTdjYzkyMmQxZTJlXkEyXkFqcGdeQXVyNjU0OTQ0OTY@._V1_SX300.jpg,90,tt0119488,8.2,"525,672",movie
125,Die Hard,1988,R,20 Jul 1988,132 min,John McTiernan,An NYPD officer tries to save his wife and several others taken hostage by German terrorists during a Christmas party at the Nakatomi Plaza in Los Angeles.,https://m.media-amazon.com/images/M/MV5BZjRlNDUxZjAtOGQ4OC00OTNlLTgxNmQtYTBmMDgwZmNmNjkxXkEyXkFqcGdeQXVyNzkwMjQ5NzM@._V1_SX300.jpg,72,tt0095016,8.2,"771,761",movie
126,Monty Python and the Holy Grail,1975,PG,25 May 1975,91 min,"Terry Gilliam, Terry Jones","King Arthur and his Knights of the Round Table embark on a surreal, low-budget search for the Holy Grail, encountering many, very silly obstacles.",https://m.media-amazon.com/images/M/MV5BN2IyNTE4YzUtZWU0Mi00MGIwLTgyMmQtMzQ4YzQxYWNlYWE2XkEyXkFqcGdeQXVyNjU0OTQ0OTY@._V1_SX300.jpg,91,tt0071853,8.2,"495,768",movie
127,Rashomon,1950,Not Rated,26 Dec 1951,88 min,Akira Kurosawa,"The rape of a bride and the murder of her samurai husband are recalled from the perspectives of a bandit, the bride, the samurai's ghost and a woodcutter.",https://m.media-amazon.com/images/M/MV5BMjEzMzA4NDE2OF5BMl5BanBnXkFtZTcwNTc5MDI2NQ@@._V1_SX300.jpg,98,tt0042876,8.2,"149,560",movie
128,Yojimbo,1961,Not Rated,13 Sep 1961,110 min,Akira Kurosawa,A crafty ronin comes to a town divided by two criminal gangs and decides to play them against each other to free the town.,https://m.media-amazon.com/images/M/MV5BZThiZjAzZjgtNDU3MC00YThhLThjYWUtZGRkYjc2ZWZlOTVjXkEyXkFqcGdeQXVyNTA4NzY1MzY@._V1_SX300.jpg,N/A,tt0055630,8.2,"108,438",movie
129,Batman Begins,2005,PG-13,15 Jun 2005,140 min,Christopher Nolan,"After training with his mentor, Batman begins his fight to free crime-ridden Gotham City from corruption.",https://m.media-amazon.com/images/M/MV5BOTY4YjI2N2MtYmFlMC00ZjcyLTg3YjEtMDQyM2ZjYzQ5YWFkXkEyXkFqcGdeQXVyMTQxNzMzNDI@._V1_SX300.jpg,70,tt0372784,8.2,"1,288,835",movie
130,Green Book,2018,PG-13,16 Nov 2018,130 min,Peter Farrelly,A working-class Italian-American bouncer becomes the driver of an African-American classical pianist on a tour of venues through the 1960s American South.,https://m.media-amazon.com/images/M/MV5BYzIzYmJlYTYtNGNiYy00N2EwLTk4ZjItMGYyZTJiOTVkM2RlXkEyXkFqcGdeQXVyODY1NDk1NjE@._V1_SX300.jpg,69,tt6966692,8.2,"353,416",movie
131,Downfall,2004,R,08 Apr 2005,156 min,Oliver Hirschbiegel,"Traudl Junge, the final secretary for Adolf Hitler, tells of the Nazi dictator's final days in his Berlin bunker at the end of WWII.",https://m.media-amazon.com/images/M/MV5BMTU0NTU5NTAyMl5BMl5BanBnXkFtZTYwNzYwMDg2._V1_SX300.jpg,82,tt0363163,8.2,"327,354",movie
132,Children of Heaven,1997,PG,22 Jan 1999,89 min,Majid Majidi,"After a boy loses his sister's pair of shoes, he goes on a series of adventures in order to find them. When he can't, he tries a new way to ""win"" a new pair.",https://m.media-amazon.com/images/M/MV5BZTYwZWQ4ZTQtZWU0MS00N2YwLWEzMDItZWFkZWY0MWVjODVhXkEyXkFqcGdeQXVyNjU0OTQ0OTY@._V1_SX300.jpg,77,tt0118849,8.3,"63,299",movie
133,Unforgiven,1992,R,07 Aug 1992,130 min,Clint Eastwood,"Retired Old West gunslinger William Munny reluctantly takes on one last job, with the help of his old partner Ned Logan and a young man, The ""Schofield Kid.""",https://m.media-amazon.com/images/M/MV5BODM3YWY4NmQtN2Y3Ni00OTg0LWFhZGQtZWE3ZWY4MTJlOWU4XkEyXkFqcGdeQXVyNjU0OTQ0OTY@._V1_SX300.jpg,85,tt0105695,8.2,"369,713",movie
134,Ran,1985,R,01 Jun 1985,162 min,Akira Kurosawa,"In Medieval Japan, an elderly warlord retires, handing over his empire to his three sons. However, he vastly underestimates how the new-found power will corrupt them and cause them to turn on each other...and him.",https://m.media-amazon.com/images/M/MV5BZDBjZTM4ZmEtOTA5ZC00NTQzLTkyNzYtMmUxNGU2YjI5YjU5L2ltYWdlXkEyXkFqcGdeQXVyNTAyODkwOQ@@._V1_SX300.jpg,96,tt0089881,8.2,"109,256",movie
135,Some Like It Hot,1959,Passed,19 Mar 1959,121 min,Billy Wilder,"After two male musicians witness a mob hit, they flee the state in an all-female band disguised as women, but further complications set in.",https://m.media-amazon.com/images/M/MV5BNzAyOGIxYjAtMGY2NC00ZTgyLWIwMWEtYzY0OWQ4NDFjOTc5XkEyXkFqcGdeQXVyNjU0OTQ0OTY@._V1_SX300.jpg,98,tt0053291,8.2,"240,125",movie
136,Howl's Moving Castle,2004,PG,17 Jun 2005,119 min,Hayao Miyazaki,"When an unconfident young woman is cursed with an old body by a spiteful witch, her only chance of breaking the spell lies with a self-indulgent yet insecure young wizard and his companions in his legged, walking castle.",https://m.media-amazon.com/images/M/MV5BNmM4YTFmMmItMGE3Yy00MmRkLTlmZGEtMzZlOTQzYjk3MzA2XkEyXkFqcGdeQXVyMTMxODk2OTU@._V1_SX300.jpg,80,tt0347149,8.2,"323,962",movie
137,All About Eve,1950,Passed,27 Oct 1950,138 min,Joseph L. Mankiewicz,A seemingly timid but secretly ruthless ingénue insinuates herself into the lives of an aging Broadway star and her circle of theater friends.,https://m.media-amazon.com/images/M/MV5BMTY2MTAzODI5NV5BMl5BanBnXkFtZTgwMjM4NzQ0MjE@._V1_SX300.jpg,98,tt0042192,8.2,"118,991",movie
138,A Beautiful Mind,2001,PG-13,04 Jan 2002,135 min,Ron Howard,"After John Nash, a brilliant but asocial mathematician, accepts secret work in cryptography, his life takes a turn for the nightmarish.",https://m.media-amazon.com/images/M/MV5BMzcwYWFkYzktZjAzNC00OGY1LWI4YTgtNzc5MzVjMDVmNjY0XkEyXkFqcGdeQXVyMTQxNzMzNDI@._V1_SX300.jpg,72,tt0268978,8.2,"833,458",movie
